{"$schema":"http://json-schema.org/draft-07/schema#","title":"InternalAlert v1","type":"object","additionalProperties":false,"required":["schemaVersion","alertId","assessmentId","eventId","transactionId","customerId","severity","matchedRules","rulesetVersion","createdAt","traceId"],"properties":{"schemaVersion":{"const":1},"alertId":{"type":"string"},"assessmentId":{"type":"string"},"eventId":{"type":"string"},"transactionId":{"type":"string"},"customerId":{"type":"string"},"severity":{"enum":["LOW","MEDIUM","HIGH","CRITICAL"]},"matchedRules":{"type":"array","minItems":1,"items":{"type":"object","additionalProperties":false,"required":["ruleId","ruleVersion","evidenceCodes"],"properties":{"ruleId":{"type":"string"},"ruleVersion":{"type":"integer","minimum":1},"evidenceCodes":{"type":"array","items":{"type":"string"}}}}},"rulesetVersion":{"type":"integer","minimum":1},"createdAt":{"type":"string"},"traceId":{"type":"string"}}}
